{
  "slug": "anger-stored-in-fat-cells",
  "title": "Is anger (or negative emotion) stored in fat cells? A systematic review of the primary evidence",
  "question": "Do primary studies provide evidence that anger, or negative emotion more broadly, is stored, retained, or held within adipocytes (fat cells) or adipose tissue?",
  "pico": {
    "population": "Humans or animals with adipose tissue",
    "exposure": "Anger or other negative emotional states (acute or chronic)",
    "comparator": "Neutral emotional state, non-adipose tissue, or unexposed control",
    "outcome": "Evidence that the emotional state is stored, retained, encoded, or physically held within adipocytes / adipose tissue (as opposed to merely correlating with fat mass)"
  },
  "inclusion_criteria": [
    "Primary research (empirical study with original data), not a review, essay, or opinion piece",
    "Addresses an emotional construct — anger specifically, or a negative-emotion / psychological-stress construct",
    "Examines adipocytes or adipose tissue as the site of interest",
    "Tests or measures a proposed storage, retention, memory, or encoding relationship between the emotional state and the fat tissue (not merely an association with fat quantity)"
  ],
  "exclusion_reasons": [
    "not-primary-research",
    "no-emotion-construct",
    "no-adipose-focus",
    "no-storage-or-memory-claim",
    "association-with-fat-mass-only",
    "mechanism-unrelated",
    "wrong-topic",
    "wrong-language",
    "duplicate"
  ],
  "extraction_profile": {
    "arm_noun": "study finding",
    "summary_field": "claim_support",
    "fields": [
      { "key": "population", "label": "Population", "required": true, "help": "human, rodent, cell line, etc." },
      { "key": "emotion_construct", "label": "Emotion studied", "required": true, "help": "anger, chronic stress, depression, general negative affect, etc." },
      { "key": "adipose_measure", "label": "Adipose measure", "required": true, "help": "what was measured in fat cells / adipose tissue" },
      { "key": "proposed_mechanism", "label": "Proposed mechanism", "required": false, "help": "the pathway by which emotion is claimed to reach/persist in fat" },
      { "key": "evidence_type", "label": "Evidence type", "required": true,
        "categorical": {
          "values": {
            "experimental": { "label": "Experimental / mechanistic", "tone": "accent" },
            "observational": { "label": "Observational / correlational", "tone": "neutral" },
            "anecdotal": { "label": "Anecdotal / theoretical", "tone": "warn" }
          }
        }
      },
      { "key": "claim_support", "label": "Bearing on the claim", "required": true,
        "categorical": {
          "values": {
            "supports-literal-storage": { "label": "Supports literal storage of emotion in fat", "tone": "negative" },
            "mechanistic-link": { "label": "Real stress–adipose mechanism (not emotion 'storage')", "tone": "accent" },
            "association-only": { "label": "Association with fat mass only", "tone": "neutral" },
            "no-support": { "label": "No support / off-topic", "tone": "neutral" },
            "contradicts": { "label": "Contradicts the claim", "tone": "positive" }
          }
        }
      },
      { "key": "notes", "label": "Notes", "required": false, "in_table": false }
    ]
  },
  "searches": []
}
